{
  "format": "midicore-timeline",
  "format_version": "1.0",
  "meta": {
    "source_file": "multitrack.mid",
    "parsed_at": "2026-07-03T00:06:40",
    "midi_format": 1,
    "ticks_per_beat": 480,
    "duration_seconds": 1.8,
    "duration_ticks": 1440,
    "note_count": 9,
    "track_count": 3,
    "has_sustain_data": false,
    "unterminated_notes": 0
  },
  "tempo_map": [
    {
      "tick": 0,
      "seconds": 0.0,
      "tempo_us_per_beat": 600000,
      "bpm": 100.0
    }
  ],
  "time_signature_map": [
    {
      "tick": 0,
      "seconds": 0.0,
      "numerator": 3,
      "denominator": 4,
      "bar": 1
    }
  ],
  "tracks": [
    {
      "index": 0,
      "name": "",
      "channels": [],
      "programs": [],
      "note_count": 0
    },
    {
      "index": 1,
      "name": "Melody",
      "channels": [
        0
      ],
      "programs": [
        {
          "channel": 0,
          "program": 0,
          "name": "Acoustic Grand Piano"
        }
      ],
      "note_count": 6
    },
    {
      "index": 2,
      "name": "Bass",
      "channels": [
        1
      ],
      "programs": [
        {
          "channel": 1,
          "program": 42,
          "name": "Cello"
        }
      ],
      "note_count": 3
    }
  ],
  "sustain_events": [],
  "notes": [
    {
      "id": 0,
      "pitch": 48,
      "name": "C3",
      "note_name": "C",
      "octave": 3,
      "velocity": 70,
      "track": 2,
      "track_name": "Bass",
      "channel": 1,
      "program": 42,
      "instrument": "Cello",
      "start_tick": 0,
      "end_tick_explicit": 480,
      "end_tick_sounding": 480,
      "duration_ticks_explicit": 480,
      "duration_ticks_sounding": 480,
      "start_seconds": 0.0,
      "end_seconds_explicit": 0.6,
      "end_seconds_sounding": 0.6,
      "duration_seconds_explicit": 0.6,
      "duration_seconds_sounding": 0.6,
      "sustained": false,
      "bar": 1,
      "beat": 1.0
    },
    {
      "id": 1,
      "pitch": 72,
      "name": "C5",
      "note_name": "C",
      "octave": 5,
      "velocity": 88,
      "track": 1,
      "track_name": "Melody",
      "channel": 0,
      "program": 0,
      "instrument": "Acoustic Grand Piano",
      "start_tick": 0,
      "end_tick_explicit": 240,
      "end_tick_sounding": 240,
      "duration_ticks_explicit": 240,
      "duration_ticks_sounding": 240,
      "start_seconds": 0.0,
      "end_seconds_explicit": 0.3,
      "end_seconds_sounding": 0.3,
      "duration_seconds_explicit": 0.3,
      "duration_seconds_sounding": 0.3,
      "sustained": false,
      "bar": 1,
      "beat": 1.0
    },
    {
      "id": 2,
      "pitch": 74,
      "name": "D5",
      "note_name": "D",
      "octave": 5,
      "velocity": 88,
      "track": 1,
      "track_name": "Melody",
      "channel": 0,
      "program": 0,
      "instrument": "Acoustic Grand Piano",
      "start_tick": 240,
      "end_tick_explicit": 480,
      "end_tick_sounding": 480,
      "duration_ticks_explicit": 240,
      "duration_ticks_sounding": 240,
      "start_seconds": 0.3,
      "end_seconds_explicit": 0.6,
      "end_seconds_sounding": 0.6,
      "duration_seconds_explicit": 0.3,
      "duration_seconds_sounding": 0.3,
      "sustained": false,
      "bar": 1,
      "beat": 1.5
    },
    {
      "id": 3,
      "pitch": 43,
      "name": "G2",
      "note_name": "G",
      "octave": 2,
      "velocity": 70,
      "track": 2,
      "track_name": "Bass",
      "channel": 1,
      "program": 42,
      "instrument": "Cello",
      "start_tick": 480,
      "end_tick_explicit": 960,
      "end_tick_sounding": 960,
      "duration_ticks_explicit": 480,
      "duration_ticks_sounding": 480,
      "start_seconds": 0.6,
      "end_seconds_explicit": 1.2,
      "end_seconds_sounding": 1.2,
      "duration_seconds_explicit": 0.6,
      "duration_seconds_sounding": 0.6,
      "sustained": false,
      "bar": 1,
      "beat": 2.0
    },
    {
      "id": 4,
      "pitch": 76,
      "name": "E5",
      "note_name": "E",
      "octave": 5,
      "velocity": 88,
      "track": 1,
      "track_name": "Melody",
      "channel": 0,
      "program": 0,
      "instrument": "Acoustic Grand Piano",
      "start_tick": 480,
      "end_tick_explicit": 720,
      "end_tick_sounding": 720,
      "duration_ticks_explicit": 240,
      "duration_ticks_sounding": 240,
      "start_seconds": 0.6,
      "end_seconds_explicit": 0.9,
      "end_seconds_sounding": 0.9,
      "duration_seconds_explicit": 0.3,
      "duration_seconds_sounding": 0.3,
      "sustained": false,
      "bar": 1,
      "beat": 2.0
    },
    {
      "id": 5,
      "pitch": 74,
      "name": "D5",
      "note_name": "D",
      "octave": 5,
      "velocity": 88,
      "track": 1,
      "track_name": "Melody",
      "channel": 0,
      "program": 0,
      "instrument": "Acoustic Grand Piano",
      "start_tick": 720,
      "end_tick_explicit": 960,
      "end_tick_sounding": 960,
      "duration_ticks_explicit": 240,
      "duration_ticks_sounding": 240,
      "start_seconds": 0.9,
      "end_seconds_explicit": 1.2,
      "end_seconds_sounding": 1.2,
      "duration_seconds_explicit": 0.3,
      "duration_seconds_sounding": 0.3,
      "sustained": false,
      "bar": 1,
      "beat": 2.5
    },
    {
      "id": 6,
      "pitch": 48,
      "name": "C3",
      "note_name": "C",
      "octave": 3,
      "velocity": 70,
      "track": 2,
      "track_name": "Bass",
      "channel": 1,
      "program": 42,
      "instrument": "Cello",
      "start_tick": 960,
      "end_tick_explicit": 1440,
      "end_tick_sounding": 1440,
      "duration_ticks_explicit": 480,
      "duration_ticks_sounding": 480,
      "start_seconds": 1.2,
      "end_seconds_explicit": 1.8,
      "end_seconds_sounding": 1.8,
      "duration_seconds_explicit": 0.6,
      "duration_seconds_sounding": 0.6,
      "sustained": false,
      "bar": 1,
      "beat": 3.0
    },
    {
      "id": 7,
      "pitch": 72,
      "name": "C5",
      "note_name": "C",
      "octave": 5,
      "velocity": 88,
      "track": 1,
      "track_name": "Melody",
      "channel": 0,
      "program": 0,
      "instrument": "Acoustic Grand Piano",
      "start_tick": 960,
      "end_tick_explicit": 1200,
      "end_tick_sounding": 1200,
      "duration_ticks_explicit": 240,
      "duration_ticks_sounding": 240,
      "start_seconds": 1.2,
      "end_seconds_explicit": 1.5,
      "end_seconds_sounding": 1.5,
      "duration_seconds_explicit": 0.3,
      "duration_seconds_sounding": 0.3,
      "sustained": false,
      "bar": 1,
      "beat": 3.0
    },
    {
      "id": 8,
      "pitch": 71,
      "name": "B4",
      "note_name": "B",
      "octave": 4,
      "velocity": 88,
      "track": 1,
      "track_name": "Melody",
      "channel": 0,
      "program": 0,
      "instrument": "Acoustic Grand Piano",
      "start_tick": 1200,
      "end_tick_explicit": 1440,
      "end_tick_sounding": 1440,
      "duration_ticks_explicit": 240,
      "duration_ticks_sounding": 240,
      "start_seconds": 1.5,
      "end_seconds_explicit": 1.8,
      "end_seconds_sounding": 1.8,
      "duration_seconds_explicit": 0.3,
      "duration_seconds_sounding": 0.3,
      "sustained": false,
      "bar": 1,
      "beat": 3.5
    }
  ]
}