{
  "format": "midicore-timeline",
  "format_version": "1.0",
  "meta": {
    "source_file": "sustain_demo.mid",
    "parsed_at": "2026-07-03T00:06:40",
    "midi_format": 1,
    "ticks_per_beat": 480,
    "duration_seconds": 1.75,
    "duration_ticks": 1680,
    "note_count": 3,
    "track_count": 1,
    "has_sustain_data": true,
    "unterminated_notes": 0
  },
  "tempo_map": [
    {
      "tick": 0,
      "seconds": 0.0,
      "tempo_us_per_beat": 500000,
      "bpm": 120.0
    }
  ],
  "time_signature_map": [
    {
      "tick": 0,
      "seconds": 0.0,
      "numerator": 4,
      "denominator": 4,
      "bar": 1
    }
  ],
  "tracks": [
    {
      "index": 0,
      "name": "sustain demo",
      "channels": [
        0
      ],
      "programs": [
        {
          "channel": 0,
          "program": null,
          "name": null
        }
      ],
      "note_count": 3
    }
  ],
  "sustain_events": [
    {
      "tick": 0,
      "seconds": 0.0,
      "channel": 0,
      "value": 127,
      "pedal_down": true,
      "track": 0
    },
    {
      "tick": 960,
      "seconds": 1.0,
      "channel": 0,
      "value": 0,
      "pedal_down": false,
      "track": 0
    }
  ],
  "notes": [
    {
      "id": 0,
      "pitch": 60,
      "name": "C4",
      "note_name": "C",
      "octave": 4,
      "velocity": 85,
      "track": 0,
      "track_name": "sustain demo",
      "channel": 0,
      "program": null,
      "instrument": null,
      "start_tick": 0,
      "end_tick_explicit": 240,
      "end_tick_sounding": 960,
      "duration_ticks_explicit": 240,
      "duration_ticks_sounding": 960,
      "start_seconds": 0.0,
      "end_seconds_explicit": 0.25,
      "end_seconds_sounding": 1.0,
      "duration_seconds_explicit": 0.25,
      "duration_seconds_sounding": 1.0,
      "sustained": true,
      "bar": 1,
      "beat": 1.0
    },
    {
      "id": 1,
      "pitch": 67,
      "name": "G4",
      "note_name": "G",
      "octave": 4,
      "velocity": 85,
      "track": 0,
      "track_name": "sustain demo",
      "channel": 0,
      "program": null,
      "instrument": null,
      "start_tick": 240,
      "end_tick_explicit": 480,
      "end_tick_sounding": 960,
      "duration_ticks_explicit": 240,
      "duration_ticks_sounding": 720,
      "start_seconds": 0.25,
      "end_seconds_explicit": 0.5,
      "end_seconds_sounding": 1.0,
      "duration_seconds_explicit": 0.25,
      "duration_seconds_sounding": 0.75,
      "sustained": true,
      "bar": 1,
      "beat": 1.5
    },
    {
      "id": 2,
      "pitch": 72,
      "name": "C5",
      "note_name": "C",
      "octave": 5,
      "velocity": 85,
      "track": 0,
      "track_name": "sustain demo",
      "channel": 0,
      "program": null,
      "instrument": null,
      "start_tick": 1200,
      "end_tick_explicit": 1680,
      "end_tick_sounding": 1680,
      "duration_ticks_explicit": 480,
      "duration_ticks_sounding": 480,
      "start_seconds": 1.25,
      "end_seconds_explicit": 1.75,
      "end_seconds_sounding": 1.75,
      "duration_seconds_explicit": 0.5,
      "duration_seconds_sounding": 0.5,
      "sustained": false,
      "bar": 1,
      "beat": 3.5
    }
  ]
}